{
  "schema_version": 2,
  "task_id": "T-036",
  "lease_generation": 1,
  "branch": "task/T-036-g1",
  "base_commit": "e6123f54ee291b0fd408bc7c4f765529177b4115",
  "head_commit": "60c997e33d66a9136585375797f7c73d48153c62",
  "decision_ids": [
    "D-20260812-016"
  ],
  "submitted_at": "2026-08-12T15:20:13Z",
  "changed_files": [
    "协作/扫描快照/country-tags-summary.md",
    "协作/扫描快照/country-tags.json"
  ],
  "notes": ""
}
