{
  "schema_version": 2,
  "task_id": "T-029",
  "lease_generation": 1,
  "branch": "task/T-029-g1",
  "base_commit": "684b3ce72d9a24563569e807979bb7d0afe1c57a",
  "head_commit": "5028c1e448b2cedfe9524dd38ab585b16ace4186",
  "decision_ids": [
    "D-20260812-001"
  ],
  "submitted_at": "2026-08-12T01:53:58Z",
  "changed_files": [
    "协作/state-overrides/东亚.json",
    "协作/决策记录/D-20260812-001.json",
    "协作/决策记录/D-20260812-001.md",
    "协作/扫描产出.md",
    "设定书/00-总览与索引.md",
    "设定书/08-地理卷.md",
    "设定书/11-政权清单.md"
  ],
  "notes": ""
}
