{
  "schema_version": 2,
  "task_id": "T-026",
  "lease_generation": 1,
  "branch": "task/T-026-g1",
  "base_commit": "4209a498dae5184aabd5001df9d54e28091f2a48",
  "head_commit": "7a8bf1530d3c413cda7600fd110b2d15e3dc2162",
  "decision_ids": [
    "D-20260812-007"
  ],
  "submitted_at": "2026-08-12T02:20:25Z",
  "changed_files": [
    "协作/state-overrides/拉丁美洲.json"
  ],
  "notes": ""
}
