{
  "schema_version": 2,
  "task_id": "T-024",
  "lease_generation": 1,
  "branch": "task/T-024-g1",
  "base_commit": "2831b6e07cab1f4c49350af03a892cfed80b9b33",
  "head_commit": "0cda41461e6cda07e972ff943af1ebf6c45e11db",
  "decision_ids": [
    "D-20260812-005"
  ],
  "submitted_at": "2026-08-12T02:15:57Z",
  "changed_files": [
    "协作/state-overrides/欧洲.json",
    "协作/state-overrides/非洲.json"
  ],
  "notes": ""
}
