{
  "schema_version": 1,
  "task_id": "T-015",
  "lease_generation": 1,
  "branch": "task/T-015-g1",
  "base_commit": "68464d416af05a01d896a656e19103c1aa4971d8",
  "head_commit": "e2b65309722a20b4e2f17c2df5693de2bbefb9cc",
  "decision_ids": [
    "D-20260811-008"
  ],
  "submitted_at": "2026-08-11T06:26:09Z",
  "changed_files": [
    "docs/协作框架.md",
    "scripts/workflow.py",
    "tests/test_workflow.py",
    "协作/README.md",
    "协作/tasks.json",
    "协作/任务台账.md",
    "协作/决策记录/D-20260811-008.json",
    "协作/决策记录/D-20260811-008.md",
    "协作/审查记录/codex-T-015-实现验证-2026-08-11.md",
    "协作/环境/C.json"
  ],
  "notes": "完成Git UTF-8解码、四项生命周期原子提交、显式fetch后的本地或origin分支tip校验、NTP文档与机器C OpenCode真实权限冒烟。"
}
