{
  "schema_version": 2,
  "task_id": "T-039",
  "lease_generation": 1,
  "branch": "task/T-039-g1",
  "base_commit": "833f1136b9aeb3a93105fdd5f0d4b6df15a11a5c",
  "head_commit": "206ac30abef5d756360625f046e4cf12bccc0046",
  "decision_ids": [
    "D-20260811-012",
    "D-20260812-019"
  ],
  "submitted_at": "2026-08-12T07:45:38Z",
  "changed_files": [
    "schemas/decision.schema.json",
    "scripts/workflow.py",
    "tests/test_workflow.py",
    "任务书/T-039.json",
    "协作/tasks.json",
    "协作/任务台账.md",
    "协作/决策记录/D-20260812-019.json",
    "协作/决策记录/D-20260812-019.md"
  ],
  "notes": "固定33ed231严格祖先截止并要求confirmed_by=user；94项测试与统一校验通过"
}
