{
  "schema_version": 1,
  "task_id": "T-012",
  "lease_generation": 1,
  "branch": "task/T-012-g1",
  "base_commit": "f35616c1970ed867e0f228465674e2d141eb6046",
  "head_commit": "d4c463148d329c67460b1e109d7a24481566e904",
  "decision_ids": [
    "D-20260811-004"
  ],
  "submitted_at": "2026-08-11T03:08:06Z",
  "changed_files": [
    ".opencode/agent/execute.md",
    "docs/协作框架.md",
    "schemas/state-overrides.schema.json",
    "scripts/state_transform.py",
    "scripts/workflow.py",
    "tests/test_state_transform.py",
    "协作/README.md",
    "协作/state-overrides/.gitkeep",
    "协作/tasks.json",
    "协作/任务台账.md",
    "协作/决策记录/D-20260811-004.json",
    "协作/决策记录/D-20260811-004.md"
  ],
  "notes": "机器C完成受控转换器、声明式Schema、集成夹具和任务链重构；39项测试通过。未读取真实本体，真实端到端生成与加载测试留待T-028/full机。"
}
