{
  "schema_version": 2,
  "task_id": "T-040",
  "lease_generation": 1,
  "branch": "task/T-040-g1",
  "base_commit": "de154156ddab4371905289498b0530b1509b13b0",
  "head_commit": "9884f4ff0748e3305fa66d746fdc22d67a7a3f61",
  "decision_ids": [
    "D-20260811-010",
    "D-20260812-020"
  ],
  "submitted_at": "2026-08-12T08:16:28Z",
  "changed_files": [
    ".opencode/agent/execute.md",
    ".opencode/agent/scan.md",
    ".opencode/agent/verify.md",
    "scripts/workflow.py",
    "tests/test_workflow.py",
    "任务书/T-040.json",
    "协作/tasks.json",
    "协作/任务台账.md",
    "协作/决策记录/D-20260812-020.json",
    "协作/决策记录/D-20260812-020.md"
  ],
  "notes": "三个 subagent 显式拒绝七类 filesystem MCP 变更工具；OpenCode 1.18.9 debug 实测；95项测试与统一校验通过"
}
