{
  "schema_version": 2,
  "task_id": "T-020",
  "lease_generation": 1,
  "branch": "task/T-020-g1",
  "base_commit": "1c4f4b486713603ecd3812e2a2020ba6f4ebf835",
  "head_commit": "74346c5cfced676e516022f92beb3adf81a961eb",
  "decision_ids": [
    "D-20260811-023"
  ],
  "submitted_at": "2026-08-12T01:39:15Z",
  "changed_files": [
    "协作/state-overrides/东亚.json"
  ],
  "notes": ""
}
