{
  "schema_version": 2,
  "task_id": "T-027",
  "lease_generation": 1,
  "branch": "task/T-027-g1",
  "base_commit": "e4d89f556b23181abe2e6f42d095e4a4b36098d9",
  "head_commit": "a9b6c99baed3f27ca8d619e89c3e7cf88dbd446d",
  "decision_ids": [
    "D-20260812-008"
  ],
  "submitted_at": "2026-08-12T02:26:00Z",
  "changed_files": [
    "协作/扫描产出.md"
  ],
  "notes": ""
}
