{
  "schema_version": 2,
  "task_id": "T-051",
  "lease_generation": 1,
  "branch": "task/T-051-g1",
  "base_commit": "3edb1f902fa83458af842af28ad7bee1e6fd7c2c",
  "head_commit": "7a14b310d71390375f10aa0b62161ecc56bfbd29",
  "decision_ids": [
    "D-20260819-001",
    "D-20260819-003"
  ],
  "submitted_at": "2026-08-19T09:12:28Z",
  "changed_files": [
    "docs/K001-1910历史重写前置清单.md",
    "docs/已知问题与待办.md",
    "mod/common/units/txg_templates.txt",
    "mod/history/countries/CHI - China.txt",
    "mod/history/countries/ENG - Britain.txt",
    "mod/history/countries/FRA - France.txt",
    "mod/history/countries/GER - Germany.txt",
    "mod/history/units/CHI_1910.txt",
    "mod/history/units/CHI_1910_naval.txt",
    "mod/history/units/CHI_1910_naval_legacy.txt",
    "mod/history/units/CHI_1910_naval_mtg.txt",
    "mod/history/units/ENG_1910.txt",
    "mod/history/units/ENG_1910_naval.txt",
    "mod/history/units/FRA_1910.txt",
    "mod/history/units/FRA_1910_naval.txt",
    "mod/history/units/GER_1910.txt",
    "mod/history/units/GER_1910_naval.txt",
    "scripts/oob_build.py",
    "scripts/oob_validation.py",
    "scripts/workflow.py",
    "tests/test_oob_validation.py",
    "任务书/R-006-1910专属历史/T-051.json",
    "任务书/R-006-1910专属历史/T-052.json",
    "协作/tasks.json",
    "协作/任务台账.md",
    "协作/决策记录/D-20260819-002.json",
    "协作/决策记录/D-20260819-002.md",
    "协作/决策记录/D-20260819-003.json",
    "协作/决策记录/D-20260819-003.md"
  ],
  "notes": "Rebuilt from the original lease under D-20260819-003. CHI OOB implementation is byte-identical to the previously verified candidate; D-20260819-002 enters main only through the controlled task merge."
}
