{
  "schema_version": 2,
  "task_id": "T-049",
  "lease_generation": 1,
  "branch": "task/T-049-g1",
  "base_commit": "e507e768c452f50a8f83b70b38736a746ff8acba",
  "head_commit": "c2a1c67ca02f962e8281a36b73c54f5cc34aebcf",
  "decision_ids": [
    "D-20260813-002"
  ],
  "submitted_at": "2026-08-14T01:45:41Z",
  "changed_files": [
    "docs/意识形态-跨极映射表.md",
    "mod/common/on_actions/00_txg_on_actions.txt",
    "mod/common/scripted_effects/00_txg_government_scripted_effects.txt",
    "mod/common/scripted_effects/00_txg_regime_effects.txt",
    "mod/localisation/english/txg_ideologies_l_english.yml",
    "mod/localisation/simp_chinese/txg_ideologies_l_simp_chinese.yml",
    "schemas/political-spectrum.schema.json",
    "schemas/task-spec.schema.json",
    "scripts/workflow.py",
    "tests/test_workflow.py",
    "任务书/R-004-领导人/T-045.json",
    "任务书/R-004-领导人/T-046.json",
    "任务书/R-004-领导人/T-049.json",
    "协作/tasks.json",
    "协作/任务台账.md",
    "协作/决策记录/D-20260813-002.json",
    "协作/决策记录/D-20260813-002.md"
  ],
  "notes": "四极/项目党派分层、schema与校验器、运行时fail-closed钩子、本地化及生命周期回归已完成；机器C完成156项单元测试和静态校验，真实HOI4加载保留机器A。"
}
