{
  "schema_version": 2,
  "task_id": "T-032",
  "lease_generation": 1,
  "branch": "task/T-032-g1",
  "base_commit": "28f3612b7a89bb2e402995635ee9e556ad04bf1e",
  "head_commit": "df87ecd54f2fb2780e955f08b49fa79109f50e69",
  "decision_ids": [
    "D-20260812-014"
  ],
  "submitted_at": "2026-08-12T06:05:00Z",
  "changed_files": [
    "schemas/snapshot.schema.json",
    "schemas/task-spec.schema.json",
    "scripts/workflow.py",
    "tests/test_workflow.py",
    "协作/README.md",
    "协作/决策记录/D-20260812-014.json"
  ],
  "notes": ""
}
